{
  "$schema": "https://json-schema.org/draft/2020-12/schema",
  "type": "object",
  "properties": {
    "formatVersion": {
      "const": 1
    },
    "name": {
      "type": "string"
    },
    "methods": {
      "type": "array",
      "items": {
        "type": "object",
        "properties": {
          "id": {
            "type": "integer",
            "minimum": 0,
            "maximum": 4294967295
          },
          "name": {
            "type": "string"
          },
          "qualifiedName": {
            "type": "string"
          },
          "owner": {
            "type": [
              "string",
              "null"
            ]
          },
          "isStatic": {
            "type": "boolean"
          },
          "returnType": {
            "type": "string"
          },
          "parameters": {
            "type": "array",
            "items": {
              "type": "object",
              "properties": {
                "name": {
                  "type": "string"
                },
                "type": {
                  "type": "string"
                }
              },
              "required": [
                "name",
                "type"
              ],
              "additionalProperties": false
            },
            "maxItems": 1000000
          },
          "locals": {
            "type": "array",
            "items": {},
            "maxItems": 1000000
          },
          "code": {
            "type": "object",
            "properties": {
              "$int32": {
                "type": "array",
                "items": {
                  "type": "integer",
                  "minimum": -2147483648,
                  "maximum": 2147483647
                },
                "maxItems": 1000000
              }
            },
            "required": [
              "$int32"
            ],
            "additionalProperties": false
          },
          "handlers": {
            "type": "array",
            "items": {
              "type": "object",
              "properties": {
                "kind": {
                  "enum": [
                    "catch",
                    "finally"
                  ]
                },
                "start": {
                  "type": "integer",
                  "minimum": 0,
                  "maximum": 4294967295
                },
                "end": {
                  "type": "integer",
                  "minimum": 0,
                  "maximum": 4294967295
                },
                "target": {
                  "type": "integer",
                  "minimum": 0,
                  "maximum": 4294967295
                },
                "slot": {
                  "type": "integer",
                  "minimum": 0,
                  "maximum": 4294967295
                },
                "handlerEnd": {
                  "type": "integer",
                  "minimum": 0,
                  "maximum": 4294967295
                }
              },
              "required": [
                "start",
                "end",
                "target"
              ],
              "additionalProperties": true
            },
            "maxItems": 1000000
          }
        },
        "required": [
          "id",
          "name",
          "qualifiedName",
          "owner",
          "isStatic",
          "returnType",
          "parameters",
          "locals",
          "code",
          "handlers"
        ],
        "additionalProperties": true
      },
      "maxItems": 1000000
    },
    "constants": {
      "type": "array",
      "items": {
        "type": [
          "number",
          "boolean",
          "string",
          "null"
        ]
      },
      "maxItems": 1000000
    },
    "types": {
      "type": "array",
      "items": {
        "type": "object",
        "properties": {
          "id": {
            "type": "integer",
            "minimum": 0,
            "maximum": 4294967295
          },
          "name": {
            "type": "string"
          },
          "fields": {
            "type": "array",
            "items": {
              "type": "object",
              "properties": {
                "name": {
                  "type": "string"
                },
                "type": {
                  "type": "string"
                },
                "index": {
                  "type": "integer",
                  "minimum": 0,
                  "maximum": 4294967295
                }
              },
              "required": [
                "name",
                "type",
                "index"
              ],
              "additionalProperties": true
            },
            "maxItems": 1000000
          },
          "initializer": {
            "type": [
              "integer",
              "null"
            ]
          }
        },
        "required": [
          "id",
          "name",
          "fields"
        ],
        "additionalProperties": true
      },
      "maxItems": 1000000
    },
    "statics": {
      "type": "array",
      "items": {
        "type": "object",
        "properties": {
          "name": {
            "type": "string"
          },
          "type": {
            "type": "string"
          },
          "value": {
            "type": [
              "number",
              "boolean",
              "string",
              "null"
            ]
          }
        },
        "required": [
          "name",
          "type",
          "value"
        ],
        "additionalProperties": true
      },
      "maxItems": 1000000
    },
    "sequencePoints": {
      "type": "array",
      "items": {
        "type": "object",
        "properties": {
          "id": {
            "type": "integer",
            "minimum": 0,
            "maximum": 4294967295
          },
          "methodId": {
            "type": "integer",
            "minimum": 0,
            "maximum": 4294967295
          },
          "offset": {
            "type": "integer",
            "minimum": 0,
            "maximum": 4294967295
          },
          "uri": {
            "type": "string"
          },
          "start": {
            "type": "integer",
            "minimum": 0,
            "maximum": 4294967295
          },
          "end": {
            "type": "integer",
            "minimum": 0,
            "maximum": 4294967295
          },
          "line": {
            "type": "integer",
            "minimum": 1
          },
          "column": {
            "type": "integer",
            "minimum": 1
          }
        },
        "required": [
          "id",
          "methodId",
          "offset",
          "uri",
          "start",
          "end",
          "line",
          "column"
        ],
        "additionalProperties": true
      },
      "maxItems": 1000000
    },
    "entryPoint": {
      "type": [
        "integer",
        "null"
      ],
      "minimum": 0
    },
    "outputKind": {
      "enum": [
        "library",
        "exe"
      ]
    },
    "sources": {
      "type": "array",
      "items": {
        "type": "object",
        "properties": {
          "uri": {
            "type": "string"
          },
          "version": {
            "type": "integer"
          },
          "text": {
            "type": "string"
          }
        },
        "required": [
          "uri",
          "version"
        ],
        "additionalProperties": true
      },
      "maxItems": 1000000
    }
  },
  "required": [
    "formatVersion",
    "methods",
    "constants",
    "types",
    "statics",
    "sequencePoints",
    "entryPoint",
    "sources"
  ],
  "additionalProperties": true
}
