{
  "constants": [
    null,
    "System.Action",
    1,
    "string",
    0,
    "parked-root",
    5
  ],
  "entryPoint": 3,
  "formatVersion": 1,
  "methods": [
    {
      "asyncOrigin": "Program.Main",
      "asyncRole": "kickoff",
      "code": {
        "$int32": [
          18,
          1,
          0,
          3,
          0,
          0,
          9,
          0,
          0,
          2,
          0,
          0,
          1,
          0,
          0,
          3,
          0,
          0,
          9,
          0,
          0,
          3,
          1,
          0,
          9,
          0,
          0,
          2,
          1,
          0,
          28,
          2,
          1,
          16,
          450,
          1,
          17,
          0,
          0,
          1,
          0,
          0,
          3,
          1,
          0,
          9,
          0,
          0,
          1,
          0,
          0,
          17,
          0,
          0
        ]
      },
      "handlers": [],
      "id": 0,
      "isStatic": true,
      "locals": [
        {
          "hidden": true,
          "name": "$t0",
          "slot": 0,
          "type": "<>AsyncCapture0"
        },
        {
          "declaredAt": 62,
          "hidden": true,
          "isConst": false,
          "isIteration": false,
          "isUsing": false,
          "name": "<>capture",
          "scopeEnd": 219,
          "scopeEndPc": 16,
          "scopeStartPc": 7,
          "slot": 1,
          "type": "<>AsyncCapture0"
        }
      ],
      "name": "Main",
      "owner": "Program",
      "parameters": [],
      "qualifiedName": "Program.Main",
      "returnType": "System.Threading.Tasks.Task"
    },
    {
      "asyncOrigin": "Program.Main",
      "asyncRole": "body",
      "code": {
        "$int32": [
          0,
          0,
          0,
          1,
          2,
          0,
          19,
          3,
          0,
          8,
          0,
          0,
          1,
          4,
          0,
          1,
          5,
          0,
          21,
          0,
          0,
          9,
          0,
          0,
          3,
          0,
          0,
          9,
          0,
          0,
          0,
          1,
          0,
          1,
          6,
          0,
          16,
          491,
          1,
          16,
          449,
          1,
          9,
          0,
          0,
          0,
          2,
          0,
          16,
          10,
          0,
          9,
          0,
          0,
          0,
          3,
          0,
          2,
          0,
          0,
          1,
          4,
          0,
          20,
          0,
          0,
          16,
          0,
          1,
          9,
          0,
          0,
          1,
          0,
          0,
          3,
          0,
          0,
          9,
          0,
          0,
          1,
          0,
          0,
          17,
          0,
          0
        ]
      },
      "handlers": [],
      "id": 1,
      "isStatic": true,
      "locals": [
        {
          "declaredAt": 102,
          "hidden": false,
          "isConst": false,
          "isIteration": false,
          "isUsing": false,
          "name": "live",
          "scopeEnd": 219,
          "scopeEndPc": 27,
          "scopeStartPc": 8,
          "slot": 0,
          "type": "string[]"
        }
      ],
      "name": "<>AsyncBody0_Main",
      "owner": "Program",
      "parameters": [],
      "qualifiedName": "Program.<>AsyncBody0_Main",
      "returnType": "void",
      "sourceRange": {
        "end": 219,
        "start": 62,
        "uri": "Program.cs"
      }
    },
    {
      "asyncOrigin": "Program.Main",
      "asyncRole": "capture",
      "code": {
        "$int32": [
          15,
          1,
          0,
          9,
          0,
          0,
          1,
          0,
          0,
          17,
          0,
          0
        ]
      },
      "handlers": [],
      "id": 2,
      "isStatic": false,
      "locals": [
        {
          "declaredAt": 62,
          "hidden": true,
          "isConst": false,
          "isIteration": false,
          "isUsing": false,
          "name": "this",
          "scopeEnd": 219,
          "scopeStartPc": 0,
          "slot": 0,
          "type": "<>AsyncCapture0"
        }
      ],
      "name": "Invoke",
      "owner": "<>AsyncCapture0",
      "parameters": [],
      "qualifiedName": "<>AsyncCapture0.Invoke",
      "returnType": "void"
    },
    {
      "asyncOrigin": "Program.Main",
      "asyncRole": "kickoff",
      "code": {
        "$int32": [
          15,
          0,
          0,
          16,
          449,
          1,
          17,
          0,
          0
        ]
      },
      "handlers": [],
      "id": 3,
      "isStatic": true,
      "locals": [],
      "name": "<startup>",
      "owner": null,
      "parameters": [],
      "qualifiedName": "<startup>",
      "returnType": "void"
    }
  ],
  "name": "Application",
  "sequencePoints": [
    {
      "column": 5,
      "end": 140,
      "id": 0,
      "line": 5,
      "methodId": 1,
      "offset": 0,
      "start": 93,
      "uri": "Program.cs"
    },
    {
      "column": 5,
      "end": 165,
      "id": 1,
      "line": 6,
      "methodId": 1,
      "offset": 10,
      "start": 145,
      "uri": "Program.cs"
    },
    {
      "column": 5,
      "end": 183,
      "id": 2,
      "line": 7,
      "methodId": 1,
      "offset": 15,
      "start": 170,
      "uri": "Program.cs"
    },
    {
      "column": 5,
      "end": 215,
      "id": 3,
      "line": 8,
      "methodId": 1,
      "offset": 18,
      "start": 188,
      "uri": "Program.cs"
    }
  ],
  "sources": [
    {
      "text": "using System;\nusing System.Threading.Tasks;\nclass Program {\n  static async Task Main() {\n    string[] live = new string[] { \"parked-root\" };\n    await Task.Delay(5);\n    GC.Collect();\n    Console.WriteLine(live[0]);\n  }\n}\n",
      "uri": "Program.cs",
      "version": 1
    }
  ],
  "statics": [],
  "types": [
    {
      "fields": [],
      "id": 0,
      "name": "Program"
    },
    {
      "fields": [],
      "id": 1,
      "name": "<>AsyncCapture0"
    }
  ]
}
